{
  "reportId": "500123",
  "name": "Example Title",
  "businessPurpose": "example_value",
  "reportDate": "example_value",
  "startDate": "example_value",
  "endDate": "example_value",
  "countryCode": "example_value",
  "countrySubDivisionCode": "example_value",
  "currencyCode": "example_value",
  "policyId": "500123",
  "reportFormId": "500123",
  "ledgerId": "500123",
  "approvalStatus": "example_value",
  "approvalStatusId": "500123",
  "paymentStatus": "example_value",
  "paymentStatusId": "500123",
  "userId": "500123",
  "isSubmitted": true,
  "isSentBack": true,
  "creationDate": "example_value",
  "submitDate": "example_value",
  "reportVersion": 10,
  "customData": [],
  "links": []
}